<?xml version="1.0" encoding="UTF-8" standalone="no"?>
<xs:schema  xmlns:xs="http://www.w3.org/2001/XMLSchema">
  <xs:element name="company">
    <xs:complexType>
      <xs:sequence>
        <xs:element name="empleado">
          <xs:complexType>
            <xs:sequence>
              <xs:element type="xs:string" name="nombre"/>
              <xs:element type="xs:string" name="apellido"/>
              <xs:element type="xs:int" name="contacto"/>
              <xs:element type="xs:string" name="email"/>
              <xs:element name="direccion">
                <xs:complexType>
                  <xs:sequence>
                    <xs:element type="xs:string" name="ciudad"/>
                    <xs:element type="xs:string" name="estado"/>
                    <xs:element type="xs:int" name="zip"/>
                  </xs:sequence>
                </xs:complexType>
              </xs:element>
            </xs:sequence>
          </xs:complexType>
        </xs:element>
      </xs:sequence>
    </xs:complexType>
  </xs:element>
</xs:schema>